{
  "version": 1,
  "storageDir": "C:\\Users\\micha\\.mcp-tasks\\tasks",
  "defaultStorage": "global",
  "enforcement": "warn",
  "autoCommit": false,
  "claimTtlHours": 4,
  "trackManifest": true,
  "tasksDirName": "agent-tasks",
  "projects": [
    {
      "prefix": "MCPAT",
      "path": "C:\\code\\mcp-agent-tasks",
      "storage": "local"
    }
  ]
}